{
  "bytes": "01 02 01 00 02 01 03 03 0E 42 72 69 74 69 73 68 20 50 72 65 61 6D 70 04 04 4F 4D 47 50 05 06 01 01 02 00 03 01 06 07 42 50 2D 30 30 30 31 10 06 00 43 6C 65 61 6E 10 07 01 43 72 75 6E 63 68 10 05 02 4C 65 61 64 10 17 03 53 6F 6C 6F 20 42 6F 6F 73 74 20 2F 20 48 69 67 68 20 47 61 69 6E 11 03 01 78 00 20 09 01 FF 00 00 08 47 61 69 6E 20 09 02 FF 00 00 08 42 61 73 73 20 0B 03 FF 00 00 08 4D 69 64 64 6C 65 20 0B 04 FF 00 00 08 54 72 65 62 6C 65 20 0D 05 FF 00 00 04 50 72 65 73 65 6E 63 65 20 0B 06 03 02 00 00 42 72 69 67 68 74 20 12 07 FF 00 FF 0F 4D 61 73 74 65 72 20 56 6F 6C 75 6D 65 20 18 08 FF 05 00 00 48 65 61 74 65 72 20 43 75 72 72 65 6E 74 20 28 6D 41 29 21 05 06 00 4F 66 66 21 08 06 01 42 72 69 67 68 74 21 0E 06 02 45 78 74 72 61 20 42 72 69 67 68 74 30 06 03 01 F4 01 B0 04 40 08 28 00 28 00 00 00 14 00 41 0B 02 02 04 58 02 BC 02 FA 00 0C 14 7E CA 34 12 00 01 02 03 04 05 06 07 08 09 0A 0B 0C 0D 0E 0F 10 11 12 13 14 15 16 17 18 19 1A 1B 1C 1D 1E 1F 20 21 22 23 24 25 26 27 28 29 2A 2B 2C 2D 2E 2F 30 31 32 33 34 35 36 37 38 39 3A 3B 3C 3D 3E 3F 40 41 42 43 44 45 46 47 48 49 4A 4B 4C 4D 4E 4F 50 51 52 53 54 55 56 57 58 59 5A 5B 5C 5D 5E 5F 60 61 62 63 64 65 66 67 68 69 6A 6B 6C 6D 6E 6F 70 71 72 73 74 75 76 77 78 79 7A 7B 7C 7D 7E 7F 80 81 82 83 84 85 86 87 88 89 8A 8B 8C 8D 8E 8F 90 91 92 93 94 95 96 97 98 99 9A 9B 9C 9D 9E 9F A0 A1 A2 A3 A4 A5 A6 A7 A8 A9 AA AB AC AD AE AF B0 B1 B2 B3 B4 B5 B6 B7 B8 B9 BA BB BC BD BE BF C0 C1 C2 C3 C4 C5 C6 C7 55 07 01 02 03 04 05 06 07 56 78 00 00 00 00 00 00 00 00 00 00 00 00 00 00 00 00 00 00 00 00 00 00 00 00 00 00 00 00 00 00 00 00 00 00 00 00 00 00 00 00 00 00 00 00 00 00 00 00 00 00 00 00 00 00 00 00 00 00 00 00 00 00 00 00 00 00 00 00 00 00 00 00 00 00 00 00 00 00 00 00 00 00 00 00 00 00 00 00 00 00 00 00 00 00 00 00 00 00 00 00 00 00 00 00 00 00 00 00 00 00 00 00 00 00 00 00 00 00 00 00",
  "canonical": "PROTOCOL major=1 minor=0 | MODULE_TYPE mt=TUBE_PREAMP | NAME s=\"British Preamp\" | MANUFACTURER s=\"OMGP\" | MODEL_ID model=0x0101 hw=0x0002 fw=0x0103 | SERIAL s=\"BP-0001\" | CHANNEL idx=0 s=\"Clean\" | CHANNEL idx=1 s=\"Crunch\" | CHANNEL idx=2 s=\"Lead\" | CHANNEL idx=3 s=\"Solo Boost / High Gain\" | SWITCHING flags=0x01 settle_ms=120 | PARAM id=1 scope=0xFF kind=CONTINUOUS default=2048 s=\"Gain\" | PARAM id=2 scope=0xFF kind=CONTINUOUS default=2048 s=\"Bass\" | PARAM id=3 scope=0xFF kind=CONTINUOUS default=2048 s=\"Middle\" | PARAM id=4 scope=0xFF kind=CONTINUOUS default=2048 s=\"Treble\" | PARAM id=5 scope=0xFF kind=CONTINUOUS default=1024 s=\"Presence\" | PARAM id=6 scope=0x03 kind=ENUM default=0 s=\"Bright\" | PARAM id=7 scope=0xFF kind=CONTINUOUS default=4095 s=\"Master Volume\" | PARAM id=8 scope=0xFF kind=READONLY default=0 s=\"Heater Current (mA)\" | PARAM_ENUM id=6 idx=0 s=\"Off\" | PARAM_ENUM id=6 idx=1 s=\"Bright\" | PARAM_ENUM id=6 idx=2 s=\"Extra Bright\" | AUDIO io=0x03 input_mode=1 in_max=500 out_max=1200 | POWER_LV p15=40 n15=40 p9=0 p5=20 | POWER_TUBE class=2 tubes=2 sections=4 heater_nom=600 heater_max=700 bplus_v=250 bplus_exp=12 bplus_max=20 | VENDOR vendor=0x1234 data=000102030405060708090a0b0c0d0e0f101112131415161718191a1b1c1d1e1f202122232425262728292a2b2c2d2e2f303132333435363738393a3b3c3d3e3f404142434445464748494a4b4c4d4e4f505152535455565758595a5b5c5d5e5f606162636465666768696a6b6c6d6e6f707172737475767778797a7b7c7d7e7f808182838485868788898a8b8c8d8e8f909192939495969798999a9b9c9d9e9fa0a1a2a3a4a5a6a7a8a9aaabacadaeafb0b1b2b3b4b5b6b7b8b9babbbcbdbebfc0c1c2c3c4c5c6c7 | UNKNOWN type=0x55 data=01020304050607 | UNKNOWN type=0x56 data=000000000000000000000000000000000000000000000000000000000000000000000000000000000000000000000000000000000000000000000000000000000000000000000000000000000000000000000000000000000000000000000000000000000000000000000000000000000000000000000000",
  "fields": {
    "records": [
      {
        "major": 1,
        "minor": 0,
        "record": "PROTOCOL"
      },
      {
        "record": "MODULE_TYPE",
        "type": 3
      },
      {
        "record": "NAME",
        "s": "British Preamp"
      },
      {
        "record": "MANUFACTURER",
        "s": "OMGP"
      },
      {
        "fw_rev": 259,
        "hw_rev": 2,
        "record": "MODEL_ID",
        "vendor_model": 257
      },
      {
        "record": "SERIAL",
        "s": "BP-0001"
      },
      {
        "index": 0,
        "name": "Clean",
        "record": "CHANNEL"
      },
      {
        "index": 1,
        "name": "Crunch",
        "record": "CHANNEL"
      },
      {
        "index": 2,
        "name": "Lead",
        "record": "CHANNEL"
      },
      {
        "index": 3,
        "name": "Solo Boost / High Gain",
        "record": "CHANNEL"
      },
      {
        "flags": 1,
        "record": "SWITCHING",
        "settle_ms": 120
      },
      {
        "default": 2048,
        "kind": 0,
        "name": "Gain",
        "param_id": 1,
        "record": "PARAM",
        "scope": 255
      },
      {
        "default": 2048,
        "kind": 0,
        "name": "Bass",
        "param_id": 2,
        "record": "PARAM",
        "scope": 255
      },
      {
        "default": 2048,
        "kind": 0,
        "name": "Middle",
        "param_id": 3,
        "record": "PARAM",
        "scope": 255
      },
      {
        "default": 2048,
        "kind": 0,
        "name": "Treble",
        "param_id": 4,
        "record": "PARAM",
        "scope": 255
      },
      {
        "default": 1024,
        "kind": 0,
        "name": "Presence",
        "param_id": 5,
        "record": "PARAM",
        "scope": 255
      },
      {
        "default": 0,
        "kind": 2,
        "name": "Bright",
        "param_id": 6,
        "record": "PARAM",
        "scope": 3
      },
      {
        "default": 4095,
        "kind": 0,
        "name": "Master Volume",
        "param_id": 7,
        "record": "PARAM",
        "scope": 255
      },
      {
        "default": 0,
        "kind": 5,
        "name": "Heater Current (mA)",
        "param_id": 8,
        "record": "PARAM",
        "scope": 255
      },
      {
        "index": 0,
        "label": "Off",
        "param_id": 6,
        "record": "PARAM_ENUM"
      },
      {
        "index": 1,
        "label": "Bright",
        "param_id": 6,
        "record": "PARAM_ENUM"
      },
      {
        "index": 2,
        "label": "Extra Bright",
        "param_id": 6,
        "record": "PARAM_ENUM"
      },
      {
        "in_max_mvrms": 500,
        "input_mode": 1,
        "io_flags": 3,
        "out_max_mvrms": 1200,
        "record": "AUDIO"
      },
      {
        "n15_ma": 40,
        "p15_ma": 40,
        "p5_ma": 20,
        "p9_ma": 0,
        "record": "POWER_LV"
      },
      {
        "bplus_exp_ma": 12,
        "bplus_max_ma": 20,
        "bplus_nom_v": 250,
        "heater_max_ma": 700,
        "heater_nom_ma": 600,
        "power_class": 2,
        "record": "POWER_TUBE",
        "sections": 4,
        "tubes": 2
      },
      {
        "data": "000102030405060708090a0b0c0d0e0f101112131415161718191a1b1c1d1e1f202122232425262728292a2b2c2d2e2f303132333435363738393a3b3c3d3e3f404142434445464748494a4b4c4d4e4f505152535455565758595a5b5c5d5e5f606162636465666768696a6b6c6d6e6f707172737475767778797a7b7c7d7e7f808182838485868788898a8b8c8d8e8f909192939495969798999a9b9c9d9e9fa0a1a2a3a4a5a6a7a8a9aaabacadaeafb0b1b2b3b4b5b6b7b8b9babbbcbdbebfc0c1c2c3c4c5c6c7",
        "record": "VENDOR",
        "vendor_id": 4660
      },
      {
        "data": "01020304050607",
        "record": "UNKNOWN",
        "type": 85
      },
      {
        "data": "000000000000000000000000000000000000000000000000000000000000000000000000000000000000000000000000000000000000000000000000000000000000000000000000000000000000000000000000000000000000000000000000000000000000000000000000000000000000000000000000",
        "record": "UNKNOWN",
        "type": 86
      }
    ]
  },
  "kind": "descriptor",
  "name": "descriptor_sample",
  "note": "621 bytes; crc=0xD9C6",
  "spec_ref": "protocol-l3 \u00a74, \u00a74.1 (every record type, unknown skipped)"
}
