{
  "bytes": "14 10 04 01 07 01 02 00 00 4D 00 01",
  "canonical": "op=GET_STATUS node=0x10 seq=4 flags=0x01 state=READY channel=2 bypass=0 fault=0x00 uptime_s=77 pending=1",
  "fields": {
    "active_channel": 2,
    "bypass": 0,
    "event_pending": 1,
    "fault_code": 0,
    "flags": 1,
    "node_id": 16,
    "opcode": "GET_STATUS",
    "seq": 4,
    "state": 1,
    "uptime_s": 77
  },
  "kind": "message",
  "name": "msg_get_status_resp",
  "spec_ref": "protocol-l3 \u00a73.3 status block"
}
